{
  "$schema": "https://json-schema.org/draft/2020-12/schema",
  "title": "Signal Schedule Weekly Schedule View Read Contract",
  "type": "object",
  "required": [
    "summary",
    "filters",
    "days"
  ],
  "properties": {
    "summary": {
      "type": "object"
    },
    "filters": {
      "type": "object"
    },
    "days": {
      "type": "array"
    },
    "rolePanels": {
      "type": "array"
    },
    "rules": {
      "type": "array"
    }
  }
}