{
  "summary": {
    "weekStart": "2026-06-14",
    "weekEnd": "2026-06-20",
    "days": 7,
    "assigned": 38,
    "openSpots": 6,
    "conflicts": 4,
    "underMinimumDays": 2
  },
  "filters": {
    "agency": "Central Dispatch",
    "view": "Week",
    "role": "All roles",
    "status": "Draft preview"
  },
  "days": [
    {
      "date": "2026-06-14",
      "label": "Sun",
      "status": "under-minimum",
      "shifts": [
        {
          "shift": "Days",
          "time": "0700-1900",
          "status": "under-minimum",
          "spots": [
            {
              "code": "D1",
              "role": "Dispatcher",
              "employee": "Morgan Price",
              "source": "Pattern",
              "status": "filled"
            },
            {
              "code": "D2",
              "role": "Dispatcher",
              "employee": "Open",
              "source": "Coverage spot",
              "status": "open"
            },
            {
              "code": "S1",
              "role": "Supervisor",
              "employee": "Taylor Smith",
              "source": "Pattern",
              "status": "filled"
            }
          ],
          "warnings": [
            "Under minimum by 1 Dispatcher"
          ]
        },
        {
          "shift": "Nights",
          "time": "1900-0700",
          "status": "meets-minimum",
          "spots": [
            {
              "code": "D1",
              "role": "Dispatcher",
              "employee": "James Carter",
              "source": "Pattern",
              "status": "filled"
            },
            {
              "code": "D2",
              "role": "Dispatcher",
              "employee": "Avery Brown",
              "source": "OT Award",
              "status": "filled"
            }
          ],
          "warnings": []
        }
      ]
    },
    {
      "date": "2026-06-15",
      "label": "Mon",
      "status": "conflict",
      "shifts": [
        {
          "shift": "Days",
          "time": "0700-1900",
          "status": "conflict",
          "spots": [
            {
              "code": "D1",
              "role": "Dispatcher",
              "employee": "April Lane",
              "source": "Pattern",
              "status": "filled conflict"
            },
            {
              "code": "D2",
              "role": "Dispatcher",
              "employee": "Morgan Price",
              "source": "Generator",
              "status": "filled"
            },
            {
              "code": "S1",
              "role": "Supervisor",
              "employee": "Taylor Smith",
              "source": "Pattern",
              "status": "filled"
            }
          ],
          "warnings": [
            "April Lane has approved leave overlap"
          ]
        },
        {
          "shift": "Nights",
          "time": "1900-0700",
          "status": "meets-minimum",
          "spots": [
            {
              "code": "D1",
              "role": "Dispatcher",
              "employee": "James Carter",
              "source": "Short day",
              "status": "filled"
            },
            {
              "code": "D2",
              "role": "Dispatcher",
              "employee": "Open",
              "source": "Open shift",
              "status": "open"
            }
          ],
          "warnings": [
            "Open coverage after 0100"
          ]
        }
      ]
    },
    {
      "date": "2026-06-16",
      "label": "Tue",
      "status": "meets-minimum",
      "shifts": [
        {
          "shift": "Days",
          "time": "0700-1900",
          "status": "meets-minimum",
          "spots": [
            {
              "code": "D1",
              "role": "Dispatcher",
              "employee": "Morgan Price",
              "source": "Pattern",
              "status": "filled"
            },
            {
              "code": "D2",
              "role": "Dispatcher",
              "employee": "Avery Brown",
              "source": "Pattern",
              "status": "filled"
            },
            {
              "code": "S1",
              "role": "Supervisor",
              "employee": "Taylor Smith",
              "source": "Pattern",
              "status": "filled"
            }
          ],
          "warnings": []
        }
      ]
    },
    {
      "date": "2026-06-17",
      "label": "Wed",
      "status": "over-maximum",
      "shifts": [
        {
          "shift": "Days",
          "time": "0700-1900",
          "status": "over-maximum",
          "spots": [
            {
              "code": "D1",
              "role": "Dispatcher",
              "employee": "Morgan Price",
              "source": "Pattern",
              "status": "filled"
            },
            {
              "code": "D2",
              "role": "Dispatcher",
              "employee": "Avery Brown",
              "source": "Pattern",
              "status": "filled"
            },
            {
              "code": "D3",
              "role": "Dispatcher",
              "employee": "Jordan Lee",
              "source": "Training coverage",
              "status": "filled"
            },
            {
              "code": "S1",
              "role": "Supervisor",
              "employee": "Taylor Smith",
              "source": "Pattern",
              "status": "filled"
            }
          ],
          "warnings": [
            "Dispatcher over maximum by 1"
          ]
        }
      ]
    },
    {
      "date": "2026-06-18",
      "label": "Thu",
      "status": "meets-minimum",
      "shifts": [
        {
          "shift": "Days",
          "time": "0700-1900",
          "status": "meets-minimum",
          "spots": [
            {
              "code": "D1",
              "role": "Dispatcher",
              "employee": "Morgan Price",
              "source": "Pattern",
              "status": "filled"
            },
            {
              "code": "D2",
              "role": "Dispatcher",
              "employee": "Avery Brown",
              "source": "Pattern",
              "status": "filled"
            }
          ],
          "warnings": []
        }
      ]
    },
    {
      "date": "2026-06-19",
      "label": "Fri",
      "status": "under-minimum",
      "shifts": [
        {
          "shift": "Days",
          "time": "0700-1900",
          "status": "under-minimum",
          "spots": [
            {
              "code": "D1",
              "role": "Dispatcher",
              "employee": "Open",
              "source": "Leave request",
              "status": "open"
            },
            {
              "code": "D2",
              "role": "Dispatcher",
              "employee": "Avery Brown",
              "source": "Pattern",
              "status": "filled"
            }
          ],
          "warnings": [
            "Requires OT volunteer or mandate review"
          ]
        }
      ]
    },
    {
      "date": "2026-06-20",
      "label": "Sat",
      "status": "meets-minimum",
      "shifts": [
        {
          "shift": "Days",
          "time": "0700-1900",
          "status": "meets-minimum",
          "spots": [
            {
              "code": "D1",
              "role": "Dispatcher",
              "employee": "Jordan Lee",
              "source": "Pattern",
              "status": "filled"
            },
            {
              "code": "D2",
              "role": "Dispatcher",
              "employee": "Morgan Price",
              "source": "Trade approved",
              "status": "filled"
            }
          ],
          "warnings": []
        }
      ]
    }
  ],
  "rolePanels": [
    {
      "role": "Employee",
      "items": [
        "View personal week assignments",
        "See approved leave/trades/OT labels",
        "See conflicts that affect your own schedule"
      ]
    },
    {
      "role": "Supervisor",
      "items": [
        "Review open spots and under-minimum days",
        "See conflict badges and assignment sources",
        "Prepare OT, trade, leave, and mandate follow-up"
      ]
    },
    {
      "role": "Admin",
      "items": [
        "Preview generator runs before publish",
        "Audit manual overrides",
        "Configure future week templates and lock periods"
      ]
    }
  ],
  "rules": [
    "Weekly view is read-only in v3.0.0.",
    "Rows are grouped by day, shift, role, and coverage spot.",
    "Conflict, leave, OT, trade, qualification, and mandation indicators are displayed as preview badges.",
    "Role-based panels replace duplicate admin pages unless a workflow truly needs separation."
  ]
}